{
  "$ref": "#/definitions/apps",
  "definitions": {
    "apps": {
      "type": "object",
      "properties": {
        "label": {
          "type": "string"
        },
        "description": {
          "type": "string"
        },
        "iconUrl": {
          "type": "string"
        },
        "href": {
          "type": "string"
        },
        "iframeUrl": {
          "type": "string"
        },
        "iframeUrlLocal": {
          "type": "string"
        },
        "devOnly": {
          "type": "boolean"
        },
        "wip": {
          "type": "boolean"
        },
        "urlSync": {
          "type": "boolean"
        },
        "menuMode": {
          "type": "string",
          "enum": [
            "host",
            "delegate"
          ]
        },
        "$schema": {
          "type": "string"
        }
      },
      "required": [
        "label",
        "iconUrl"
      ],
      "additionalProperties": false
    }
  },
  "$schema": "http://json-schema.org/draft-07/schema#"
}